04/24/2026 08:45:37	AP	11989.211	kāmavallabhā	+ .(	+ (	Typo – Please note that this indicates a Global Correction that should be implemented in THREE ways in the following sequence:  LB 1)  "+ .(" —> "+ (" LB 2)  "+ ." —> "+ "  LB 3)  ".(" —> "("   OR   ".(" —> ". (" LB Transformation Number 3, is the only one with possible "crossfire". In other words, it may need to be resolved in one of two ways, but it would be worthwhile to tackle the issue if it still remains, after the First correction has been made.	srhodes@snowcrest.net:Tracking at https://github.com/sanskrit-lexicon/csl-corrections/issues/173
04/24/2026 08:48:45	AP	11989.211	kāmavallabhā	+ -vallabhaḥ + .(-bhā)	+ vallabhā	Typo – Please note that this is a Follow-Up correction to give a clearer parsing to the compound formation.	srhodes@snowcrest.net:Tracking at https://github.com/sanskrit-lexicon/csl-corrections/issues/173
04/24/2026 08:52:02	AP	11989.212	kāmavaśa	See Below	Please let me know if you intend to list the "Masculine Form", separately, in addition to the adjective in the Hierarchy List Display. My opinion it that it is not necessary, although such has been already implemented in AP. I like to have a consistent approach throughout, so please advise as to your preference.	See Above	srhodes@snowcrest.net:I intend to do this. Tracking at https://github.com/sanskrit-lexicon/csl-corrections/issues/175
04/24/2026 08:56:26	AP	11989.214	kāmavaśya	vaśya n.	vaśya a.	Typo – Here again is the issue of the abbreviation "a." in italics, which indicates "adjective". Of course the letter "n" as been erroneously used in this case. Therefore, a Very Safe Global Correction is being presented as follows: "a n." —> "a a."	srhodes@snowcrest.net:Corrected 25 Apr 2026. Rest tracked at https://github.com/sanskrit-lexicon/csl-corrections/issues/174
04/24/2026 09:06:17	AP	11989.222	kāmavṛkṣam	-vṛkṣam a. parasitical plant.	-vṛkṣaḥ a parasitical plant.	Typo – Please note that the "Masculine Gender" is confirmed by MW, VCP and SKD.  ALSO, again we have a Global Correction as the sequence: "m a. "  with the abbreviation "a." in italics, will ALWAYS indicate a mistake !  However, it may resolve in one of TWO ways depending upon the Actual Gender, being either "Masculine or Neuter".  Therefore: LB 1)  In the case of Neuter Gender the correction will be: "m a." —> "m a"  –  (while removing the italics of the letter 'a'). LB 2)  In the case of Masculine Gender the correction will be: "m a." —> "ḥ a"  –  (while removing the italics of the letter 'a').	srhodes@snowcrest.net:Corrected 25 Apr 2026. Rest cases are tracked at https://github.com/sanskrit-lexicon/csl-corrections/issues/176
04/24/2026 09:12:00	AP	11989.23	kāmavṛntam	kāmavṛntam	kāmavṛntā	Typo – Please note that this is a suggested "Print Change", for the correction to Gender. AP57 has once again "Taken on the Rest of the World", as MW, SHS, VCP and SKD print this word in the Feminine !  	srhodes@snowcrest.net:Corrected 25 Apr 2026
04/24/2026 09:16:39	AP	11989.24	kāmasū	Rukmiṇi	Rukmiṇī	Typo – Please note that this is a suggested "Print Change", for the correct spelling of the Femine Form.  This may be considered as a Global Correction as well !	srhodes@snowcrest.net:Corrected 25 Apr 2026. Also corrected one more occurrence.
04/24/2026 18:50:02	ap		eva	eva  eva  [Printed book page 0501-1]  <!!!>11.<!!!> eva  a. Ved. 1 Going, moving. 2 Speedy, quick; evo gantā; ye ca evā marutaḥ	1. instead of 11. 		gasyoun:Tracked at https://github.com/sanskrit-lexicon/csl-websanlexicon/issues/58
04/24/2026 18:50:14	ap		eva	evo gantā; ye ca evā marutaḥ Uṇ. 1. 150 .                   [ID=10713 ]    <!!!>22.<!!!> eva  ind. This particle is most frequently used to strengthen  and emphasize	2. instead of 22. 		gasyoun:Tracked at https://github.com/sanskrit-lexicon/csl-websanlexicon/issues/58
